{
  "schema": "promodeler-canonical-character/2.0",
  "id": "blouse-ponytail-woman",
  "name": "Blouse and Brown Ponytail Woman",
  "base": "RiggedWoman_v4",
  "seed": 1,
  "source": {"kind": "local_clothing", "id": "BlouseA/BlouseA.blend"},
  "face": {}, "body": {"chest": 0.25},
  "appearance": {"hairStyle": "hair_ponytail_brown"},
  "material": {},
  "wardrobe": {"top": "blouse_a"},
  "accessories": []
}
