{
  "schema": "promodeler-canonical-character/2.0",
  "id": "shared-amber-casual-woman",
  "name": "Amber Casual Outfit on Rigged Woman",
  "base": "RiggedWoman_v5",
  "seed": 1,
  "source": {
    "kind": "shared_wardrobe"
  },
  "face": {},
  "body": {
    "chest": 0.25
  },
  "appearance": {
    "hairStyle": "hair_ponytail_brown"
  },
  "material": {},
  "wardrobe": {
    "top": "amber_crop_tshirt",
    "bottom": "amber_jeans",
    "shoes": "amber_boots"
  },
  "accessories": []
}
