{
  "schema": "promodeler-canonical-character/2.0",
  "id": "rainy-wardrobe",
  "name": "Rainy Selectable Wardrobe",
  "base": "Rainy_Wardrobe_v2",
  "seed": 1,
  "source": {
    "kind": "native_wardrobe",
    "base": "Rainy_Rigged_v1"
  },
  "face": {},
  "body": {},
  "appearance": {},
  "material": {},
  "wardrobe": {
    "top": "rainy_shirt",
    "bottom": "rainy_pants",
    "shoes": "rainy_boots"
  },
  "accessories": []
}
